{
  "dataset": "d365-finops-pqu",
  "schema_version": "1.1.0",
  "generated_at": "2026-10-13T13:44:17.669863Z",
  "source": {
    "publisher": "Microsoft",
    "repository": "MicrosoftDocs/dynamics-365-unified-operations-public",
    "branch": "main",
    "file_path": "articles/fin-ops-core/dev-itpro/get-started/quality-updates-schedule.md",
    "commit": "7d86a35169692606d303c21e204ae6032d44d44e",
    "article_url": "https://learn.microsoft.com/en-us/dynamics365/fin-ops-core/dev-itpro/get-started/quality-updates-schedule",
    "raw_url": "https://raw.githubusercontent.com/MicrosoftDocs/dynamics-365-unified-operations-public/7d86a35169692606d303c21e204ae6032d44d44e/articles/fin-ops-core/dev-itpro/get-started/quality-updates-schedule.md",
    "markdown_date": "2026-10-13",
    "sha256": "8431bf5fb97becf088a0eaa4eec8f42cb7f86dcafc7f68f9d4b3d972b5cf1eb0",
    "retrieved_at": "2026-10-13T13:44:17.669863Z"
  },
  "count": 227,
  "records": [
    {
      "id": "train_window:10.0.46-PQU-1",
      "kind": "train_window",
      "category": "train",
      "title": "10.0.46 PQU-1 train",
      "start_date": "2025-02-09",
      "end_date": "2026-03-14",
      "pqu_id": "10.0.46-PQU-1",
      "application_version": "10.0.46",
      "station": null,
      "status": "Completed",
      "source_key": "schedule",
      "url": "https://learn.microsoft.com/en-us/dynamics365/fin-ops-core/dev-itpro/get-started/quality-updates-schedule#high-level-pqu-train-schedule",
      "warnings": [
        "cutoff-start-year-mismatch"
      ]
    },
    {
      "id": "preview:10.0.45",
      "kind": "preview",
      "category": "service_update",
      "title": "10.0.45 preview",
      "start_date": "2025-07-28",
      "end_date": "2025-07-28",
      "pqu_id": null,
      "application_version": "10.0.45",
      "station": null,
      "status": null,
      "source_key": "service_updates",
      "url": "https://learn.microsoft.com/en-us/dynamics365/fin-ops-core/dev-itpro/get-started/public-preview-releases#targeted-release-schedule-dates-subject-to-change",
      "warnings": []
    },
    {
      "id": "preview_latest_update:10.0.45",
      "kind": "preview_latest_update",
      "category": "service_update",
      "title": "10.0.45 latest preview update",
      "start_date": "2025-08-08",
      "end_date": "2025-08-08",
      "pqu_id": null,
      "application_version": "10.0.45",
      "station": null,
      "status": null,
      "source_key": "service_updates",
      "url": "https://learn.microsoft.com/en-us/dynamics365/fin-ops-core/dev-itpro/get-started/public-preview-releases#targeted-release-schedule-dates-subject-to-change",
      "warnings": []
    },
    {
      "id": "general_availability:10.0.45",
      "kind": "general_availability",
      "category": "service_update",
      "title": "10.0.45 general availability",
      "start_date": "2025-09-12",
      "end_date": "2025-09-12",
      "pqu_id": null,
      "application_version": "10.0.45",
      "station": null,
      "status": null,
      "source_key": "service_updates",
      "url": "https://learn.microsoft.com/en-us/dynamics365/fin-ops-core/dev-itpro/get-started/public-preview-releases#targeted-release-schedule-dates-subject-to-change",
      "warnings": []
    },
    {
      "id": "autoupdate_first:10.0.45",
      "kind": "autoupdate_first",
      "category": "service_update",
      "title": "10.0.45 first autoupdate (production)",
      "start_date": "2025-10-03",
      "end_date": "2025-10-03",
      "pqu_id": null,
      "application_version": "10.0.45",
      "station": null,
      "status": null,
      "source_key": "service_updates",
      "url": "https://learn.microsoft.com/en-us/dynamics365/fin-ops-core/dev-itpro/get-started/public-preview-releases#targeted-release-schedule-dates-subject-to-change",
      "warnings": []
    },
    {
      "id": "preview:10.0.46",
      "kind": "preview",
      "category": "service_update",
      "title": "10.0.46 preview",
      "start_date": "2025-10-24",
      "end_date": "2025-10-24",
      "pqu_id": null,
      "application_version": "10.0.46",
      "station": null,
      "status": null,
      "source_key": "service_updates",
      "url": "https://learn.microsoft.com/en-us/dynamics365/fin-ops-core/dev-itpro/get-started/public-preview-releases#targeted-release-schedule-dates-subject-to-change",
      "warnings": []
    },
    {
      "id": "autoupdate_second:10.0.45",
      "kind": "autoupdate_second",
      "category": "service_update",
      "title": "10.0.45 second autoupdate (production)",
      "start_date": "2025-10-31",
      "end_date": "2025-10-31",
      "pqu_id": null,
      "application_version": "10.0.45",
      "station": null,
      "status": null,
      "source_key": "service_updates",
      "url": "https://learn.microsoft.com/en-us/dynamics365/fin-ops-core/dev-itpro/get-started/public-preview-releases#targeted-release-schedule-dates-subject-to-change",
      "warnings": []
    },
    {
      "id": "preview_latest_update:10.0.46",
      "kind": "preview_latest_update",
      "category": "service_update",
      "title": "10.0.46 latest preview update",
      "start_date": "2025-11-17",
      "end_date": "2025-11-17",
      "pqu_id": null,
      "application_version": "10.0.46",
      "station": null,
      "status": null,
      "source_key": "service_updates",
      "url": "https://learn.microsoft.com/en-us/dynamics365/fin-ops-core/dev-itpro/get-started/public-preview-releases#targeted-release-schedule-dates-subject-to-change",
      "warnings": []
    },
    {
      "id": "general_availability:10.0.46",
      "kind": "general_availability",
      "category": "service_update",
      "title": "10.0.46 general availability",
      "start_date": "2025-12-26",
      "end_date": "2025-12-26",
      "pqu_id": null,
      "application_version": "10.0.46",
      "station": null,
      "status": null,
      "source_key": "service_updates",
      "url": "https://learn.microsoft.com/en-us/dynamics365/fin-ops-core/dev-itpro/get-started/public-preview-releases#targeted-release-schedule-dates-subject-to-change",
      "warnings": []
    },
    {
      "id": "preview:10.0.47",
      "kind": "preview",
      "category": "service_update",
      "title": "10.0.47 preview",
      "start_date": "2026-01-26",
      "end_date": "2026-01-26",
      "pqu_id": null,
      "application_version": "10.0.47",
      "station": null,
      "status": null,
      "source_key": "service_updates",
      "url": "https://learn.microsoft.com/en-us/dynamics365/fin-ops-core/dev-itpro/get-started/public-preview-releases#targeted-release-schedule-dates-subject-to-change",
      "warnings": []
    },
    {
      "id": "autoupdate_first:10.0.46",
      "kind": "autoupdate_first",
      "category": "service_update",
      "title": "10.0.46 first autoupdate (production)",
      "start_date": "2026-02-01",
      "end_date": "2026-02-01",
      "pqu_id": null,
      "application_version": "10.0.46",
      "station": null,
      "status": null,
      "source_key": "service_updates",
      "url": "https://learn.microsoft.com/en-us/dynamics365/fin-ops-core/dev-itpro/get-started/public-preview-releases#targeted-release-schedule-dates-subject-to-change",
      "warnings": []
    },
    {
      "id": "change_cutoff:10.0.46-PQU-1",
      "kind": "change_cutoff",
      "category": "train",
      "title": "10.0.46 PQU-1 change cutoff",
      "start_date": "2026-02-04",
      "end_date": "2026-02-04",
      "pqu_id": "10.0.46-PQU-1",
      "application_version": "10.0.46",
      "station": null,
      "status": "Completed",
      "source_key": "schedule",
      "url": "https://learn.microsoft.com/en-us/dynamics365/fin-ops-core/dev-itpro/get-started/quality-updates-schedule#high-level-pqu-train-schedule",
      "warnings": [
        "cutoff-start-year-mismatch"
      ]
    },
    {
      "id": "preview_latest_update:10.0.47",
      "kind": "preview_latest_update",
      "category": "service_update",
      "title": "10.0.47 latest preview update",
      "start_date": "2026-02-16",
      "end_date": "2026-02-16",
      "pqu_id": null,
      "application_version": "10.0.47",
      "station": null,
      "status": null,
      "source_key": "service_updates",
      "url": "https://learn.microsoft.com/en-us/dynamics365/fin-ops-core/dev-itpro/get-started/public-preview-releases#targeted-release-schedule-dates-subject-to-change",
      "warnings": []
    },
    {
      "id": "autoupdate_second:10.0.46",
      "kind": "autoupdate_second",
      "category": "service_update",
      "title": "10.0.46 second autoupdate (production)",
      "start_date": "2026-03-01",
      "end_date": "2026-03-01",
      "pqu_id": null,
      "application_version": "10.0.46",
      "station": null,
      "status": null,
      "source_key": "service_updates",
      "url": "https://learn.microsoft.com/en-us/dynamics365/fin-ops-core/dev-itpro/get-started/public-preview-releases#targeted-release-schedule-dates-subject-to-change",
      "warnings": []
    },
    {
      "id": "change_cutoff:10.0.46-PQU-2",
      "kind": "change_cutoff",
      "category": "train",
      "title": "10.0.46 PQU-2 change cutoff",
      "start_date": "2026-03-04",
      "end_date": "2026-03-04",
      "pqu_id": "10.0.46-PQU-2",
      "application_version": "10.0.46",
      "station": null,
      "status": "Completed",
      "source_key": "schedule",
      "url": "https://learn.microsoft.com/en-us/dynamics365/fin-ops-core/dev-itpro/get-started/quality-updates-schedule#high-level-pqu-train-schedule",
      "warnings": []
    },
    {
      "id": "train_window:10.0.46-PQU-2",
      "kind": "train_window",
      "category": "train",
      "title": "10.0.46 PQU-2 train",
      "start_date": "2026-03-09",
      "end_date": "2026-04-11",
      "pqu_id": "10.0.46-PQU-2",
      "application_version": "10.0.46",
      "station": null,
      "status": "Completed",
      "source_key": "schedule",